{
  "mode": "advanced",
  "host": {
    "url": "https://host.nxt.blackbaud.com"
  },
  "app": {
    "title": "Blackbaud - SKY UX Application"
  },
  "compileMode": "jit",
  "params": [
    "envid",
    "svcid"
  ],
  "appSettings":
    { "a11y": {
        "rules": {
          "area-alt": { "enabled": true },
          "audio-caption": { "enabled": true },
          "button-name": { "enabled": true },
          "document-title": { "enabled": true },
          "empty-heading": { "enabled": true },
          "frame-title": { "enabled": true },
          "frame-title-unique": { "enabled": true },
          "image-alt": { "enabled": true },
          "image-redundant-alt": { "enabled": true },
          "input-image-alt": { "enabled": true },
          "link-name": { "enabled": true },
          "object-alt": { "enabled": true },
          "server-side-image-map": { "enabled": true },
          "video-caption": { "enabled": true },
          "video-description": { "enabled": true },

          "definition-list": { "enabled": true },
          "dlitem": { "enabled": true },
          "definition-list": { "enabled": true },
          "dlitem": { "enabled": true },
          "empty-heading": { "enabled": true },
          "layout-table": { "enabled": true },
          "list": { "enabled": true },
          "listitem": { "enabled": true },
          "p-as-heading": { "enabled": true },
          "heading-order": { "enabled": true },
          "href-no-hash": { "enabled": true },
          "layout-table": { "enabled": true },
          "list": { "enabled": true },
          "listitem": { "enabled": true },
          "p-as-heading": { "enabled": true },

          "scope-attr-valid": { "enabled": true },
          "table-duplicate-name": { "enabled": true },
          "table-fake-caption": { "enabled": true },
          "td-has-header": { "enabled": true },
          "td-headers-attr": { "enabled": true },
          "th-has-data-cells": { "enabled": true },

          "checkboxgroup": { "enabled": true },
          "label": { "enabled": true },
          "radiogroup": { "enabled": true },

          "duplicate-id": { "enabled": true },
          "html-has-lang": { "enabled": true },
          "html-lang-valid": { "enabled": true },
          "meta-refresh": { "enabled": true },
          "valid-lang": { "enabled": true },

          "accesskeys": { "enabled": true },
          "bypass": { "enabled": true },
          "tabindex": { "enabled": true },

          "aria-allowed-attr": { "enabled": true },
          "aria-required-attr": { "enabled": true },
          "aria-required-children": { "enabled": true },
          "aria-required-parent": { "enabled": true },
          "aria-roles": { "enabled": true },
          "aria-valid-attr": { "enabled": true },
          "aria-valid-attr-value": { "enabled": true },
          "button-name": { "enabled": true },
          "link-name": { "enabled": true },

          "blink": { "enabled": true },
          "color-contrast": { "enabled": true },
          "link-in-text-block": { "enabled": true },
          "marquee": { "enabled": true },
          "meta-viewport": { "enabled": true },
          "meta-viewport-large": { "enabled": true }
        }
      }
  }
}
